comment,likes,dislikes
심건우 스트라이커잖아,4805,23
"ㅋㅋㅋㅋㅋ민정이 찐으로 당황했을듯
마루야 골넣어줘 생각했을텐데 바로 벤치ㅋㅋㅋㅋㅋㅋ",4634,23
"아니 근데 마루 떡 싫어하는데
일부로 다 먹은 얘기는 왜 없냐...유나랑 잘 됐으면...

은 무슨 바로 민정코인 풀매수!",4385,94
"보았다...나는 한때의 맨유를 보았어..
압박당해 후방빌드업 ㅈ박고, 롱패스 날려서 역습당하는 그 맨유를.....",3607,29
쟤들 되도않게 압박하다보면 후반전에 알아서 퍼질거고 교체로 마루들어가서 민준이 어시 받아먹으면 개꿀,1464,19
"[정보]
심건우 포지션 표기오류건 때문에 댓글창엔
잠시 만신이 강림하여 사과를 하시고는 홀연히
사라지셨다
만신은....실제로 있었어....",1134,21
분명 작가님이 댓글로 배뎃갔는데 꿈인가..?,722,21
마루 살찐 이유가 저거였네 떡볶이 같은거는 계속 먹으면 많이 물리는데 저정도면 진짜 좋아했'었'나 보네. 민정이랑 잘됬으면 좋겠다.,711,22
